{"$schema": "http://json-schema.org/draft-07/schema#", "$id": "https://full-video-pipeline/animations/kinetic-title-mosaic.schema.json", "title": "KineticTitleMosaic instance", "type": "object", "additionalProperties": false, "required": ["extras"], "properties": {"$schema": {"type": "string"}, "instanceId": {"type": "string"}, "theme": {"$ref": "https://full-video-pipeline/schemas/animations.schema.json#/definitions/theme"}, "global": {"$ref": "https://full-video-pipeline/schemas/animations.schema.json#/definitions/global"}, "elements": {"type": "array", "items": {"type": "object", "additionalProperties": true, "required": ["id"], "properties": {"id": {"type": "string", "pattern": "^word-[0-9]+$"}, "text": {"type": ["string", "null"]}, "delay": {"type": ["number", "null"], "minimum": 0, "maximum": 60000}, "duration": {"type": ["number", "null"], "minimum": 1, "maximum": 60000}, "easing": {"$ref": "https://full-video-pipeline/schemas/animations.schema.json#/definitions/easingName"}, "position": {"$ref": "https://full-video-pipeline/schemas/animations.schema.json#/definitions/element/properties/position"}, "size": {"type": "object", "additionalProperties": false, "properties": {"fontSize": {"type": ["number", "null"], "minimum": 4, "maximum": 1000}, "scale": {"type": ["number", "null"], "minimum": 0.05, "maximum": 20}}}, "color": {"$ref": "https://full-video-pipeline/schemas/animations.schema.json#/definitions/element/properties/color"}, "hidden": {"type": "boolean", "default": false}, "custom": {"type": "object", "additionalProperties": true, "properties": {"variant": {"type": "string", "enum": ["slide-up", "slide-left", "fade-zoom", "mask-wipe", "blur-burn", "scale-pop"]}, "weight": {"type": "number", "minimum": 100, "maximum": 900}, "accent": {"type": "boolean", "default": false}, "weightTier": {"type": "string", "enum": ["light", "medium", "heavy"]}, "wipeDirection": {"type": "string", "enum": ["left", "right", "top", "bottom"]}}}}}}, "extras": {"type": "object", "additionalProperties": false, "required": ["words"], "properties": {"words": {"type": "array", "items": {"type": "string"}, "minItems": 1, "maxItems": 36}, "defaultVariant": {"type": "string", "enum": ["slide-up", "slide-left", "fade-zoom", "mask-wipe", "blur-burn", "scale-pop"], "default": "slide-up"}, "layout": {"type": "string", "enum": ["stack", "grid", "mosaic"], "default": "stack"}, "gridColumns": {"type": "integer", "minimum": 1, "maximum": 6, "default": 2}, "phrasing": {"type": "string", "enum": ["phrase-land", "staggered"], "default": "phrase-land"}, "phraseLandOverlap": {"type": "number", "minimum": 0, "maximum": 0.5, "default": 0}, "perSlotDurationSeconds": {"type": "number", "minimum": 0.2, "maximum": 3, "default": 0.5}, "staggerSeconds": {"type": "number", "minimum": 0, "maximum": 3, "default": 0.12}, "wordGapPx": {"type": "number", "minimum": 0, "maximum": 400, "default": 16}, "rowGapPx": {"type": "number", "minimum": 0, "maximum": 400, "default": 32}, "align": {"type": "string", "enum": ["left", "center", "right"], "default": "center"}, "containerWidthPct": {"type": "number", "minimum": 40, "maximum": 100, "default": 88}, "containerHeightPct": {"type": "number", "minimum": 30, "maximum": 100, "default": 70}, "wordFontRole": {"type": "string", "enum": ["heading", "body"], "default": "heading"}, "textTransform": {"type": "string", "enum": ["none", "uppercase"], "default": "none"}, "accentStyle": {"type": "string", "enum": ["color", "eyebrow"], "default": "eyebrow"}, "accentSide": {"type": "string", "enum": ["above", "below"], "default": "below"}, "eyebrowThicknessPx": {"type": "integer", "minimum": 1, "maximum": 20, "default": 3}, "eyebrowGapEm": {"type": "number", "minimum": 0, "maximum": 4, "default": 0.18}, "popDamping": {"type": "number", "minimum": 4, "maximum": 30, "default": 14}, "popStiffness": {"type": "number", "minimum": 40, "maximum": 600, "default": 160}, "popMass": {"type": "number", "minimum": 0.2, "maximum": 5, "default": 1}, "accentColor": {"type": ["string", "null"], "default": null}, "finalSettle": {"type": "boolean", "default": true}, "finalSettleScale": {"type": "number", "minimum": 1, "maximum": 1.5, "default": 1.015}, "finalSettleFrames": {"type": "integer", "minimum": 1, "maximum": 60, "default": 8}, "finalEyebrowDuration": {"type": "integer", "minimum": 1, "maximum": 120, "default": 18}, "holdAfterLandFrames": {"type": "integer", "minimum": 0, "maximum": 600, "default": 18}}}}}