{"instanceId": "kinetic-title-mosaic.defaults", "theme": {}, "global": {"speed": 1, "delayOffset": 0, "easing": "ease-out-cubic"}, "elements": [{ "id": "word-0", "text": "DATA" }], "extras": {"words": ["DATA", "IN", "MOTION"], "defaultVariant": "slide-up", "layout": "stack", "gridColumns": 2, "phrasing": "phrase-land", "phraseLandOverlap": 0, "perSlotDurationSeconds": 0.5, "staggerSeconds": 0.12, "wordGapPx": 16, "rowGapPx": 32, "align": "center", "containerWidthPct": 88, "containerHeightPct": 70, "wordFontRole": "heading", "textTransform": "none", "accentStyle": "eyebrow", "accentSide": "below", "eyebrowThicknessPx": 3, "eyebrowGapEm": 0.18, "popDamping": 14, "popStiffness": 160, "popMass": 1, "accentColor": null, "finalSettle": true, "finalSettleScale": 1.015, "finalSettleFrames": 8, "finalEyebrowDuration": 18, "holdAfterLandFrames": 18}}